{
  "$schema": "https://json-schema.org/draft/2020-12/schema",
  "$id": "handoff.schema.json",
  "title": "Implementation Handoff Payload",
  "description": "Structured payload submitted by IMPLEMENTATION when a Ticket reaches READY_FOR_REVIEW. Mirrors implementation-audit's Verification Evidence and Handoff Completeness criteria.",
  "type": "object",
  "additionalProperties": false,
  "required": [
    "ticket_id",
    "changes",
    "verification",
    "dependencies"
  ],
  "properties": {
    "ticket_id": {
      "type": "string",
      "pattern": "^T-[0-9]{3,}$"
    },
    "changes": {
      "type": "array",
      "minItems": 1,
      "description": "Main files changed and what changed in behavior.",
      "items": {
        "type": "object",
        "additionalProperties": false,
        "required": [
          "file",
          "summary"
        ],
        "properties": {
          "file": {
            "type": "string"
          },
          "summary": {
            "type": "string"
          }
        }
      }
    },
    "verification": {
      "type": "array",
      "minItems": 1,
      "description": "Reproducible verification steps per implementation-audit, Verification Evidence.",
      "items": {
        "type": "object",
        "additionalProperties": false,
        "required": [
          "step",
          "expected",
          "actual",
          "status"
        ],
        "properties": {
          "step": {
            "type": "string",
            "description": "The command or action actually run."
          },
          "expected": {
            "type": "string"
          },
          "actual": {
            "type": "string"
          },
          "status": {
            "type": "string",
            "enum": [
              "PASS",
              "UNVERIFIED"
            ],
            "description": "UNVERIFIED is mandatory (not PASS) for anything that could not actually be executed, per implementation-audit Exception Handling. A step the Developer knows failed is not submitted in a Handoff: it must be fixed and re-verified, or the Ticket is not yet ready for REVIEW."
          }
        }
      }
    },
    "dependencies": {
      "type": "array",
      "description": "Modules, interfaces or shared components this Ticket added, changed, or directly depends on. Navigation aid only, not a full dependency graph (Harness main document, section 12).",
      "items": {
        "type": "string"
      }
    },
    "review_round": {
      "type": "integer",
      "minimum": 1
    },
    "source_hash": {
      "type": "string",
      "pattern": "^[a-f0-9]{64}$"
    },
    "verification_id": {
      "type": "string",
      "minLength": 1
    }
  }
}
